doi,pmid,year,title,journal,authorString,citedBy,query,abstract
10.1002/ctm2.70683,42068080,2026,Niacin promotes motor function recovery after spinal cord injury via Hcar2-dependent microglia immunometabolic regulation.,Clinical and translational medicine,"Du H, Zeng L, Liu C, Zhou H, Wang X, Ai Q, Zhu J, Xiao N.",0,GPNMB microglia neurodegeneration [recent],"<h4>Background</h4>Traumatic spinal cord injury (SCI) induces a robust local inflammatory response that can both facilitate repair and exacerbate pathology. Hydroxycarboxylic acid receptor 2 (Hcar2) is known to exert immunomodulatory effects; however, its role in SCI and its potential for targeting Hcar2 to alleviate motor deficits remain unclear.<h4>Methods</h4>The spinal cord transcriptome following SCI, with a focus on Hcar2, was analysed via publicly available single-cell RNA sequencing datasets from mice and rhesus macaques. Additionally, an in vivo SCI mouse model with Hcar2 knockout and an in vitro LPS-induced BV2 microglial model were established to assess Hcar2 gene and protein expression, microglial activation and inflammatory responses via bulk RNA sequencing, immunofluorescence staining, Western blotting, and real-time polymerase chain reaction. To evaluate the protective effects of Hcar2 activation, niacin, a known Hcar2 agonist, was administered to mice or BV2 cells, followed by assessments of the inflammatory response and motor function.<h4>Results</h4>Hcar2 gene expression, which was enriched predominantly in spinal cord microglia, was upregulated following SCl, peaking at 7 days post-SCl. Genetic knockout of Hcar2 decreased the percentage of impaired anti-inflammatory polarized microglia and increased the inflammatory response. In contrast, Hcar2 activation with niacin in LPS-stimulated microglia BV cell models reversed mitochondrial dysfunction, increased the oxygen consumption rate and reduced the expression of the cytokines IL-6 and IL-1β. The administration of niacin to SCl mice upregulated anti-inflammatory microglia, reduced the expression of multiple proinflammatory cytokines, increased the number of motor neurons and improved motor function recovery. Notably, all these protective effects were abolished by genetic loss of Hcar2.<h4>Conclusions</h4>Hcar2 serves as a critical regulator of microglial polarization, promoting the switch from a pro"
10.1016/j.cell.2026.02.026,41875888,2026,Pan-neurodegeneration proteomics reveals disease subtypes and molecular signatures.,Cell,"Shrestha HK, Sun H, Yarbro JM, Lee D, Liu D, Wang E, McReynolds M, Zhang N, Xie B, Yang S, Yu K, Poudel S, Li Y, Yuan ZF, Kong D, Wang M, Wang Z, Niu M, Wang H, Zaman M, Wang J, Vanderwall DR, Sun Y, Wu Z, Chen PC, Bai B, High AA, Faura J, Liu C, Bennett DA, Johnson ECB, Seyfried NT, Levey AI, Haroutunian V, Serrano GE, Beach TG, DeTure M, Kanekiyo T, Petersen RC, Bu G, McLean PJ, Dickson DW, Rademakers R, Yu G, Wang X, Zhang B, Peng J.",0,GPNMB microglia neurodegeneration [recent],"Neurodegenerative diseases (NDs) pose clinical challenges due to their complexity and molecular heterogeneity. Here, we present a pan-neurodegeneration atlas (PanNDA) from multilayer, deep proteomic analysis of 2,279 human brain samples spanning 6 major NDs: Alzheimer's disease (AD), Lewy body dementia (LBD), frontotemporal lobar degeneration with TDP-43 pathology, progressive supranuclear palsy with tau pathology, vascular dementia, and Parkinson's disease. PanNDA integrates data from whole proteome, detergent-insoluble proteome, and posttranslational modifications (phosphorylation and ubiquitination), enabling intra- and inter-disease comparisons. Intra-disease analyses uncover distinct molecular subtypes (e.g., three in AD and four in LBD), reveal dysregulated pathways, and prioritize top-ranked proteins. Inter-disease comparisons identify shared alterations in NDs, such as GPNMB in microglial and lysosomal activation and NPTX2 in synaptic regulation, alongside disease-specific changes and hub regulators within protein networks. Overall, PanNDA provides a systems-level framework for understanding ND mechanisms and serves as a foundational resource that is accessible via an interactive website: https://penglab.shinyapps.io/pannda."
10.1002/2211-5463.70181,41388396,2026,The role of lipid metabolism in neuronal senescence.,FEBS open bio,"Tsagkari D, Panagiotidou E, Tavernarakis N.",0,GPNMB microglia neurodegeneration [recent],"Senescence is a complex cellular state characterised by irreversible growth arrest and metabolic reprogramming. In neurons, senescence has been mainly observed in the context of ageing and age-related neurodegeneration. Lipid metabolism plays a critical role in cellular homeostasis, with emerging evidence suggesting that alterations in lipid species, including fatty acids, cholesterol, sphingolipids and phospholipids, fundamentally drive or contribute to the senescent phenotype in both neuronal and non-neuronal cells in the brain. Namely, changes in lipid species levels result in the accumulation of lipid droplets (LDs), leading to dysregulation of membrane dynamics, and in turn to the production of bioactive lipid mediators, which collectively shape the senescence-associated secretory phenotype (SASP) in the brain. In this review, we describe the cell type-specific patterns of lipid dysregulation in neurons, astrocytes, microglia and other glial cells during senescence, highlighting the role of key lipid species and their association with senescence markers and phenotypes. Furthermore, we discuss the bidirectional relationship between lipid metabolism and mitochondrial dysfunction in cellular senescence. We also examine the molecular mechanisms through which lipid metabolic pathways can orchestrate neural senescence and their contribution to ageing and age-related neurodegenerative disorders, such as Alzheimer's disease and Parkinson's disease. Finally, we review emerging therapeutic strategies targeting lipid metabolic pathways to modulate neural senescence and potentially ameliorate age-associated brain pathology."
10.3390/antiox15040506,42072148,2026,"Review of Therapeutic Potential of Coenzyme Q10 in Ophthalmology: Focus on Age-Related Macular Degeneration, Glaucoma, and Retinitis Pigmentosa.","Antioxidants (Basel, Switzerland)","Wiciński M, Fajkiel-Madajczyk A, Kurant Z, Rzepiński Ł, Słupski M.",0,GPNMB microglia neurodegeneration [recent],"Coenzyme Q10 (CoQ10), a natural antioxidant produced by the human body, has strong anti-inflammatory properties, reduces oxidative stress, and improves mitochondrial function. It is also known for its strong neuroprotective effects. With age, endogenously produced CoQ10 levels decline, contributing to the development of chronic diseases, including eye disorders. Irreversible ocular diseases that result in blindness present a significant challenge in contemporary medicine, as no fully effective cure exists; current treatments primarily aim to decelerate disease progression, manage symptoms, and preserve residual vision. Our study reviews research on the use of CoQ10 in eye diseases like age-related macular degeneration (AMD), retinitis pigmentosa (RP), and glaucoma, which can cause permanent vision loss and are linked to oxidative stress and mitochondrial dysfunction. This article explores whether CoQ10 can be a safe and effective addition to treatment for these conditions. We also outline directions for future research and explain how CoQ10 functions in the studies discussed in this review."
10.3390/cells15080699,42041567,2026,"Astro-Versus Microglia-Enriched Transcriptomes from Aged &lt;i&gt;Atxn2&lt;/i&gt;-CAG100-Knockin Mice Suggest Underlying Pathology of RNA Processing at Ribosomes, and Possibly at U-Bodies.",Cells,"Auburger G, Kandi AR, Vutukuri R, Almaguer-Mederos LE, Gispert S, Sen NE, Key J.",0,GPNMB microglia neurodegeneration [recent],"Spinocerebellar Ataxia type 2 (SCA2) and Amyotrophic Lateral Sclerosis type 13 (ALS13) are triggered by polyglutamine expansion in Ataxin-2 (ATXN2). To understand these neurodegenerative disorders at the molecular level, the brains of 10-month-old <i>Atxn2</i>-CAG100-knockin mice were analyzed as microglial, astroglial and neuronal fractions via global RNA sequencing. Data were validated by comparison with the spinal cord oligonucleotide microarray profile or filtered by RNA-seq consistency. Here, we show that the mutation causes a massive inflammatory response in microglia and a reciprocal loss of neuronal transcripts in glial fractions, suggesting severe synapse loss. Beyond these general neurodegenerative signs, we identify pathognomonic changes in the machinery for protein translation and RNA splicing. Glial fractions showed upregulation of <i>Gpnmb</i> (to 2082%), <i>Cst7</i>, <i>Clec7a</i>, <i>Axl</i>, <i>Csf1</i>, <i>Lgals3</i>, <i>Lgals3bp</i>, <i>Slc11a1</i>, and <i>Usp18</i> as an unspecific neuroinflammatory signature, versus downregulation of axonal <i>Nefh</i> (to <19%), and synaptic <i>Scn4b</i>, <i>Camk2b</i>, <i>Rab15</i>, and <i>Grin1</i> mRNAs correlating with circuit disconnection. In all fractions, reductions in <i>Kif5a</i>, <i>Rph3a</i>, and <i>Cplx1</i> were noted versus disease-specific inductions of ribosomal subunits, presumably mirroring the partial loss-of-function of ATXN2 as RNA translation modulator. Selective accumulations of embryonic factors <i>Rnu1b2</i> and <i>Eef1a1</i> versus downregulation of adult <i>Eef1a2</i> specify the mutation impact on splicing and translation elongation. As a potential underpinning of toxic gain-of-function, the proteostasis transcript <i>Rnf213</i> appeared increased in astroglial and microglial fractions. These transcriptome data suggest altered ribosomal and spliceosome machinery, with massive microgliosis versus mild astrogliosis, at the core of SCA2 and ALS13."
10.1080/15384047.2026.2678642,42216563,2026,TFPI2 in tumor metastasis: a double-edged sword with clinical implications.,Cancer biology & therapy,"Guo Z, Luo Y, Wen J, Jiang Y, Kuang Q, Ma Q, Zheng C, Li X, You F, Fu X.",0,microglia spatial transcriptomics states [recent],"Tissue factor pathway inhibitor 2 (TFPI2), a serine protease inhibitor, plays a multifaceted role in tumor metastasis. Traditionally viewed as a metastasis suppressor, it inhibits extracellular matrix (ECM) remodeling, epithelial-mesenchymal transition, and angiogenesis. However, emerging evidence indicates that TFPI2 promotes tumor progression in glioblastoma, melanoma, and other cancers by fostering an immunosuppressive tumor microenvironment, mediating pathological ECM remodeling, and enhancing angiogenesis and hematogenous dissemination. Notably, even within the same metastatic cascade, TFPI2 exhibits divergent expression patterns and context-dependent opposing functions, acting either as a metastasis suppressor or promoter. This review summarizes its context-dependent regulatory mechanisms, investigates the underlying basis from structural duality, microenvironmental heterogeneity, and receptor differences, and evaluates its potential as a therapeutic target. Future research should elucidate spatiotemporal microenvironmental dynamics to support early screening and precise intervention."
10.1016/j.brainres.2026.150394,42208641,2026,Immune cell imaging in the glioma microenvironment.,Brain research,"Wireko AA, Ben-Jaafar A, Tan JK, Ranganathan S, Sanker V, Nkrumah-Boateng PA, Mannan KM, Mustapha MJ, Gaur A, Broekman M.",0,microglia spatial transcriptomics states [recent],"Glioblastoma remains a highly aggressive brain tumour with poor prognosis despite advances in standard therapies. The tumour microenvironment, comprising tumour cells, immune cells - predominantly tumour-associated microglia and macrophages (TAMMs) and extracellular matrix components, critically influences tumour progression and therapy resistance. TAMMs promote immunosuppression, tumour invasion, and angiogenesis, while T cells, although fewer, are suppressed by glioblastoma-mediated mechanisms, limiting anti-tumour immunity. Advances in non-invasive imaging technologies, including magnetic resonance imaging, positron emission transmission (PET), and optical methods, enable visualisation and characterisation of the immune microenvironment in vivo. Imaging agents targeting TAMM markers such as TSPO, CD163, CD68, CD206, and CX3CR1 have facilitated the mapping of immune cell distribution and functional states within gliomas. Additionally, emerging PET tracers allow monitoring of T-cell infiltration, activation, and exhaustion, providing insights into immunotherapy responses. Despite challenges such as blood brain barrier permeability, tracer specificity, and regulatory hurdles, multimodal imaging combined with radiomics and spatial transcriptomics offers promising avenues for personalised therapeutic strategies. Future directions focus on integrating immune cell imaging with theranostic approaches, nanoparticle delivery systems, and longitudinal monitoring to overcome tumour heterogeneity and improve treatment efficacy. This review highlights the evolving landscape of immune cell imaging in gliomas, emphasising its potential to enhance diagnosis, guide immunotherapy, and ultimately improve patient outcomes."
10.1016/j.gendis.2025.101979,42180999,2026,"Ammonia-induced cell death patterns in glioblastoma: Immune landscape, prognostic signature, and therapeutic target identification.",Genes & diseases,"Hu SQ, Wang J, Wang J, Zeng C, Chen R.",0,microglia spatial transcriptomics states [recent],
10.1016/j.gendis.2025.101955,41938710,2026,Understanding nerve-tumor interactions: From basic biology to therapeutic innovation.,Genes & diseases,"Sun L, Li X, Wang Y, Wang J, Xie R, Zhang N, Zhang Z.",0,microglia spatial transcriptomics states [recent],"The study of nerve-tumor interactions has emerged as a rapidly advancing and interdisciplinary field with profound implications for understanding cancer progression, prognosis, and therapeutic innovation. While this area holds significant promise for transformative discoveries, the mechanisms of nerve-tumor interactions and their translation into clinical applications remain at an early stage. This review focuses on the role of peripheral nerves in non-neurogenic solid tumors, discussing the prevalence and clinical impact of nerve-tumor interactions, their underlying forms and mechanisms, advancements in research technologies, therapeutic potential, and future challenges. By synthesizing current knowledge, integrating methodologies for studying nerve-tumor interactions, and identifying critical gaps, this work aims to provide a foundational resource to guide experimental design and stimulate interest in clinical trials targeting neural influences in cancer progression."
,,2026,"Vitamin D as a cellular endocrine system: Tissue-specific microcircuits, immune reprogramming, and metabolic resistance",iScience,"Feng J, Xiao J, Gao Z, Zhou H, Li X, Tian Y, Gao B.",0,microglia spatial transcriptomics states [recent],
10.1016/j.celrep.2026.117538,42268720,2026,Microglial states associate with lesion dynamics in multiple sclerosis.,Cell reports,"van den Bosch AMR, Khoo JH, Lu Z, Liang H, Wever D, Pu L, Eggen BJL, Uhlén M, Smolders J, Hamann J, Shang Z, Mulder J, Huitinga I.",0,microglia spatial transcriptomics states [recent],"Multiple sclerosis (MS) is a neuroinflammatory disease of the CNS characterized by demyelinating lesions. Lesion expansion contributes to disability progression, whereas remyelination may restore neurological function. How these divergent outcomes relate to microglial states remains incompletely understood. Using single-cell-resolution spatial transcriptomics, we compare lesions containing foamy to those containing ramified microglia in postmortem human brain tissue. We find distinct cellular and molecular signatures spatially associated with microglial morphology. Lesions with ramified microglia display gene expression profiles associated with myelin stability and axonal support, consistent with an environment permissive for repair. In contrast, lesions with foamy microglia exhibit immune activation, immunoglobulin production, complement activity, iron dysregulation, immune-oligodendrocytes, and demyelination. These findings show that molecular programs linked to lesion pathology are spatially segregated in association with microglial state, indicating distinct immune-glial niches associated with lesion expansion and repair."
10.1093/pm/pnag041,42268375,2026,Differential target multiplexed SCS (DTM SCS): a rational hypothesis.,"Pain medicine (Malden, Mass.)","Kapural L, Vallejo R, Cedeño DL, Chakravarthy K, Kallewaard JW, Abd-Elsayed A, Fishman MA, Murphy M, Gamache JE, Johanek LM.",0,microglia spatial transcriptomics states [recent],"<h4>Background</h4>Early in the development of technology for spinal cord stimulation (SCS) therapy, the challenge of treating chronic low back pain was met with specific electrode configurations and programming parameters designed to target and maintain paresthesia in that region. New modalities were subsequently developed to achieve long-term relief of chronic low back and leg pain and minimize unwanted stimulation. Only recently has it become clear that SCS mechanisms for modulating pain involve not only the activation of Aβ-fibers but also other mechanisms, such as the modulation of biological processes at the glial cells and neuroglial interaction.<h4>Content overview</h4>Differential Target MultiplexedTM (DTMTM) programming, a combination of multiplexed pulsed signals delivered synchronously at different rates and amplitudes, was shown in animal models to revert neurons and glia in the stimulated spinal cord from an injured state back to a noninjured state in transcriptomics and proteomics studies. This article highlights the rationale for and development of DTM SCS and provides an overview of its clinical application. We review key outcomes of pivotal DTM SCS studies within the context of other randomized clinical trials (RCTs) examining SCS for the treatment of chronic low back pain.<h4>Conclusions</h4>The development of DTM SCS is based on preclinical research, parameter refinement in a feasibility study, and confirmatory RCTs showing promise in enhancing outcomes of patients with chronic low back pain."
10.1002/hbm.70563,42265909,2026,Network-Level Convergence of Adiposity-Related Gray Matter Alterations: A Coordinate-Based Connectome Mapping Meta-Analysis With Imaging Transcriptomics.,Human brain mapping,"Li Y, Lin M, Zhang G, Zheng H, Zheng W.",0,microglia spatial transcriptomics states [recent],"Obesity is commonly associated with atrophy-like gray matter changes, such as lower gray matter volume or density, yet the affected regions reported vary widely across studies. It remains unclear whether these heterogeneous loci converge on a reproducible large-scale network, and whether weight-loss-related increases in gray matter map onto the same network or a distinct set of functional systems. We identified loci of adiposity-related gray matter reduction and post-weight-loss increases from 38 published whole-brain voxel-based morphometry studies, including case-control, dimensional adiposity, and longitudinal weight-loss contrasts. Using coordinate-based connectome mapping applied to a large normative resting-state functional connectome, we reconstructed networks associated with adiposity-related structural alterations. We further performed imaging transcriptomic and gene set enrichment analyses to characterize the molecular programs associated with the adiposity-related network. Gray matter reductions associated with adiposity converged on a reproducible, distributed large-scale network primarily involving frontoparietal control, cingulo-opercular, default mode, and Visual1 systems. In contrast, GMV/GMD increases following weight loss showed a distinct system-level distribution, with the largest contributions in cingulo-opercular, somatomotor, and dorsal attention systems, and comparatively limited representation in default mode and frontoparietal control networks. Imaging transcriptomic analyses further linked the adiposity-related network to coordinated gene expression patterns, and gene set enrichment analyses highlighted pathways related to mitochondrial energy metabolism, synaptic signaling, ion transport, and cellular protein homeostasis. Adiposity-related gray matter alterations converge on a reproducible large-scale network, but the system-level pattern differs across categorical obesity, dimensional adiposity, and GMV/GMD increases following weight los"
,,2026,"Encephalopathy: Cause, Pathogenesis, and Treatment",MedComm,"Lv S, Zhong X, Shang R, Kong L, Huang Y, Ma Y, Teng J, Wei S.",0,microglia spatial transcriptomics states [recent],
10.1002/mco2.70775,42253943,2026,Mapping Immunity With Cutting-Edge Spatial Biology and Tissue Cytometry Innovations.,MedComm,"Cárdenas-Piedra L, Samuel SG, Mungenast F, Yasothkumar D, Ecker RC, Batra J.",0,microglia spatial transcriptomics states [recent],"The immune system operates within organized tissue landscapes, where spatial relationships between cells shape the nature and outcome of immune responses. Over the past decade, protein imaging-based spatial technologies have transformed how immune responses are studied within their native tissue context, enabling simultaneous high-plex detection of proteins and transcripts at single-cell resolution. Driven by advances in computational methods such as tissue image cytometry, these approaches now allow quantitative extraction of spatial metrics such as cellular neighborhoods, cell-cell distances, coexpression patterns, and tissue architecture that are emerging as next-generation spatial biomarkers of immune function and disease diagnosis and/or prognosis. This review provides a consolidated overview of immunology through the lens of imaging-based spatial proteomics and tissue image cytometry, discussing the multiplex imaging platforms, staining strategies, and computational tools that enabled this shift. We survey applications spanning tumor immunology, autoimmune and infectious diseases, immunometabolism, neuroimmunology, and transplant immunology, revealing that immune organization is not random but spatially determined and directly linked to disease outcome. We further evaluate the strengths and limitations of current approaches and explore future directions including 3D imaging, artificial intelligence-driven spatial analysis, and the clinical translation of spatial biomarkers."
10.1002/mco2.70796,42253932,2026,Comprehensive Integrated Single-Cell and Spatial Transcriptomics Unveil the Dynamic Landscape of Betel Nut-Associated Oral Mucosal Carcinogenesis and Its Tumor Microenvironment.,MedComm,"Dong W, Huang S, Wu Y, Cao C, Li J, He Q, Wang A.",0,microglia spatial transcriptomics states [recent],"Betel nut chewing is a major etiological factor for oral squamous cell carcinoma (OSCC), yet its mechanistic underpinnings remain poorly defined. Here, we performed single-cell RNA sequencing and spatial transcriptomics from six OSCC patients to comprehensively dissect the tumor microenvironment (TME) dynamics and cellular heterogeneity associated with betel nut-induced oral mucosal carcinogenesis. We identify a fibrotic, immunosuppressive TME characterized by expanded cancer-associated fibroblasts (CAFs) and B/plasma cells, alongside depletion of cytotoxic T/NK cells and macrophages. CAFs, particularly antigen-presenting CAFs, are spatially enriched at the invasive front and drive epithelial plasticity and malignant transformation. Notably, we uncover a malignant epithelial subpopulation, LAMC2<sup>+</sup> EpiC6, enriched for epithelial-mesenchymal transition (EMT) programs, angiogenesis, and metastasis-associated pathways, which engaged in extensive crosstalk with CAFs and other nonmalignant components. Clinically, LAMC2 expression was significantly elevated in OSCC tissues from betel nut chewers, and arecoline treatment of OSCC cell lines induced LAMC2 upregulation, EMT, and enhanced migratory and invasive capacities in vitro. Collectively, our study delineates a malignant trajectory of epithelial cell progression, highlighting LAMC2<sup>+</sup> EpiC6 as a key aggressive subpopulation orchestrated by EMT-related transcriptional regulators and extracellular matrix remodeling. These findings offer mechanistic insights and identify potential therapeutic targets to disrupt tumor-stroma interplay and mitigate disease progression."
