doi,pmid,year,title,journal,authorString,citedBy,query,abstract
10.1515/nipt-2026-0006,42058367,2026,"The 30&lt;sup&gt;th&lt;/sup&gt; Scientific Conference of the Society on NeuroImmune Pharmacology in Annapolis, Maryland, May 3&lt;sup&gt;rd&lt;/sup&gt; - 6&lt;sup&gt;th&lt;/sup&gt;, 2026.",NeuroImmune pharmacology and therapeutics,"Chang L, Sil S, Fields JA, Andrews A, Ramirez S, Noel R.",0,microglia states human Alzheimer single-nucleus atlas [recent],"The 30<sup>th</sup> Annual Society on Neuroimmune Pharmacology (SNIP) conference will be held on May 3-6<sup>th</sup> at the Graduate Hotel by Hilton in Annapolis, Maryland. This 4-day conference will present preclinical, translational, and clinical research in the intersecting fields of neuro-HIV and substance use disorders, as well as related neurodegenerative conditions. The speakers and poster presenters will share cutting-edge research funded by the National Institutes of Health. On the first day, we will have two concurrent preconference symposia. The first is ""Single Cell HIV and SUD Effects on the Brain: SCORCH Consortium Progress"", with an overview and 7 presentations by investigators, highlighting the outstanding work in the Single Cell Opioid Response in the Context of HIV (SCORCH). The second concurrent symposium is ""Catalyzing Interdisciplinary Research on HIV-Associated Co-occurring Conditions."" In the evening, we will have our first Poster Session with 52 abstracts by early-stage-career investigators (ECIs), including those that received the ECI travel awards. On days 2-4, in addition to a plenary talk and two memorial lectures, we will have 11 symposia, with 62 speakers (including 12 who are early-stage career investigator travel awardees), and 65 additional poster presentations. In total, the 30<sup>th</sup> SNIP conference received 185 abstracts for the 70 oral presentations and 115 posters. Topics covered by these symposia and poster presentations include mechanistic and observational studies that evaluate neuronal injury and neuroinflammation associated with HIV brain infection, and how drugs of abuse, including stimulants, opioids, and cannabis, may exacerbate or mitigate neuropathogenesis. In addition, with the aging population of people with HIV and many with substance use disorders, recent work also evaluated how aging and various neurodegenerative disorders could further impact brain health. At the plenary lecture, Dr. Nora Volkow will highl"
10.1158/0008-5472.can-25-4018,41874311,2026,MIF-Induced CD74+ Microglia and Macrophages Promote Progression of Brain Metastasis and are Clinically Relevant Across Central Nervous System Disorders.,Cancer research,"Alvaro-Espinosa L, Marquez-Galera A, Priego N, García-Calvo V, Perea-García M, Hernandez-Oliver C, Retana D, Sanchez O, de Pablos-Aragoneses A, García-Gómez P, Graña-Castro O, Lapuente-Santana Ó, Serrano-Ron L, Al-Shahrour F, Cayuela López A, Peset I, Megías D, Ola M, Varešlija D, Young LS, Martí-Mateos Y, Enríquez JA, Hernández-Encinas E, Blanco-Aparicio C, Soengas MS, Bernhagen J, Antón-Fernández A, Ávila J, Marchena MA, Torres M, de Castro F, Márquez-Ropero M, Sierra A, Lopez-Atalaya JP, Group R, Valiente M, Baena Galán P, Sobrino C, Almenara I, Alba-Olano D, Ortega-Sabater C, Artiga MJ, Ortega-Paino E, González Piñeiro A, Fiaño Valverde C, de la Lama Zaragoza A, Londoño Quiroz A, Delgado López PD, Pascual-Llorente M, Díaz-Piqueras Á, Arriaga Aragón ÁA, Nam-Cha S, Barrena-López C, Plans Ahicart G, Escolano Otín B, Gil Aldea I, Delgado-Fernández J, Sepúlveda-Sánchez JM, Perez-Nuñez A, Hernández-Laín A, Toldos González O, Gargini R, Alcivar D, Fernández Alén JA, Blasco García de Andoain G, Cepeda Chafla S, Martínez Zamorano E, Mollejo Villanueva M, Opazo Rodríguez MS, Rodriguez de Lope Llorca Á, Arbaiza Martínez M, Múzquiz Rueda GM, Benavente S, Martínez-Ricarte F, Ramón Y Cajal S, Sesé Faustino M, Fernández Cabré L, Hernández-Losa J, Martínez-Saez E, Calero Félix L, Vargas-Osorio K.",0,microglia states human Alzheimer single-nucleus atlas [recent],"The upregulation of CD74, a chaperone involved in MHC-II antigen processing, has been mostly interpreted as indicative of antigen presentation in multiple brain disorders. However, CD74 expression has also been described in cancer cells across multiple tumor types and in the tumor microenvironment, notably in glioma. Here, we found that the presence of CD74+ microglia/macrophages, which was induced by increased levels of interferon gamma in brains affected by metastases, did not relate to its canonical pathway. Instead, the alternative function of CD74 as a cytokine receptor was pivotal. Proliferating cancer cells produced high levels of the ligand MIF that bound the CD74 receptor and induced its translocation to the nucleus where it activated a NF-κB-dependent program that promoted metastatic progression. In patients, a CD74 signature was associated with more aggressive progression of brain metastatic disease, while it had no clinical correlation with the matched primary tumor. Interestingly, a pan-disease non-canonical and clinically relevant signature derived from the CD74+ myeloid population was identified that occurred in additional brain disorders including Alzheimer's disease and multiple sclerosis. The brain-penetrant drug ibudilast, which prevents the binding of MIF to CD74, decreased brain metastasis in experimental models in vivo and in patient-derived organotypic cultures ex vivo in a primary tumor-agnostic manner. These findings suggest that MIF/CD74-induced reprogramming of myeloid cells in brain disorders is a vulnerability that could be exploited therapeutically against brain metastases, and possibly other brain disorders."
10.1172/jci199841,41837285,2026,Decoding neurodegeneration one cell at a time.,The Journal of clinical investigation,"Gautier O, Nguyen TP, Gitler AD.",0,microglia states human Alzheimer single-nucleus atlas [recent],"Neurodegenerative diseases are characterized by protein misfolding and the selective vulnerability of specific neuronal subtypes. This selective vulnerability presents a paradox; most neurodegenerative disease genes are expressed broadly throughout the brain, and some ubiquitously, but only certain types of neurons are lost while others are resistant. The molecular basis for selective neuronal vulnerability has remained a mystery, but recent genomics technological innovations are starting to provide mechanistic insights. Here, we review how single-cell genomics techniques - single-cell transcriptomics, single-cell epigenomics, and spatial transcriptomics - advance our molecular understanding of selective vulnerability and neurodegeneration across Alzheimer disease, Parkinson disease, amyotrophic lateral sclerosis, frontotemporal dementia, and Huntington disease. Together, these approaches reveal the cell types affected in disease, define disease-associated molecular states, nominate candidate determinants of vulnerability and degeneration, and situate degenerating neurons within their local tissue context. Continued development and application of these techniques, including single-cell perturbation screens, will expand descriptive atlases of relevant cell types in health and disease and identify causal mechanisms, revealing the molecular basis of vulnerability and degeneration and informing therapeutic development."
10.1080/13510002.2026.2668238,42241031,2026,Uric acid alleviates the inflammatory response in LPS-induced BV2 cells and MPTP-induced PD mice by resisting ferroptosis through the Nrf2 signalling pathway.,Redox report : communications in free radical research,"Zhou D, Xiong T, Yang B, Liu F, Mo X, Chen T, Lu P, Liang X, Li L, Qin Y, Lu D, Huang F, Yang X.",0,microglia ALS single-cell amyotrophic lateral sclerosis [recent],"<h4>Background</h4>Neuroinflammation, oxidative stress, and ferroptosis are implicated in Parkinson' s disease (PD) pathogenesis. Epidemiological studies suggest that elevated uric acid (UA) levels may reduce PD risk, but the precise molecular mechanisms involved remain unclear. In this study, we investigated the effects of UA in lipopolysaccharide (LPS) or MPP+-stimulated BV2 microglia and MPTP-induced PD mouse models.<h4>Methods</h4>BV2 cells are recognized as a standardized and reproducible neural inflammatory cell model for mechanism exploration. The anti-ferroptosis and anti-inflammatory effects of UA were assessed in LPS or MPP+ stimulated BV2 microglia and in an MPTP-induced PD mouse model. Western blot, qPCR, ELISA, and immunofluorescence were used to analyse the expression of inflammasome-related markers. ROS, MDA, GSH, and Fe²⁺ levels were measured using testing kits, while mitochondrial ultrastructure was evaluated through transmission electron microscopy. PD-related markers were assessed by ethology and immunohistochemistry. The Nrf2 inhibitor ML385 was employed to validate pathway specificity.<h4>Results</h4>We found that UA treatment reduced the expression of proinflammatory cytokines (TNF-<i>α</i>, IL-6, and IL-1β), ROS production, lipid peroxidation, and intracellular Fe²⁺ in BV2 microglia while increasing the antioxidant capacity and preserving the mitochondrial ultrastructure. In MPTP-treated mice, UA improved motor performance, preserved dopaminergic neuron density in the substantia nigra, and reduced neuroinflammation. UA activated Nrf2 signalling and upregulated GPX4 expression, which were attenuated by ML385, confirming the Nrf2 dependence of these effects.<h4>Conclusion</h4>UA alleviates ferroptosis and neuroinflammation in LPS or MPP+ stimulated BV2 microglia and MPTP-induced PD mouse models through the activation of the Nrf2 signalling pathway."
10.1080/21645515.2026.2664985,42160515,2026,"Immunotherapeutic landscape of amyotrophic lateral sclerosis: A bibliometric analysis of research trends, translational priorities, and collaboration networks (2006-2025).",Human vaccines & immunotherapeutics,"Zhang M, Yang W, Wang J, Zou B, Zheng JC, Wu Q, Gao G.",0,microglia ALS single-cell amyotrophic lateral sclerosis [recent],"Amyotrophic lateral sclerosis (ALS) remains a major therapeutic challenge, with immune dysregulation increasingly recognized as a critical driver of disease progression. Despite extensive mechanistic research, no immunotherapeutic approach has achieved consistent disease-modifying effects, raising questions about whether this translational gap reflects biological complexity or structural misalignment within the research ecosystem. To characterize the intellectual evolution of ALS immunotherapeutics research, identify immune targets with translational potential, and evaluate collaboration patterns that may influence translational efficiency, we performed a bibliometric analysis of 2,256 publications indexed in Web of Science and Scopus using network-based approaches including co-citation clustering, keyword co-occurrence, and citation burst detection implemented in CiteSpace, VOSviewer, and R-Bibliometrix. Publication output increased 8.4-fold over the study period, delineating three developmental phases. Thematic analyses revealed a shift from early emphasis on microglial biology and SOD1-based models toward recent focus areas including the gut-brain axis, C9orf72-associated immune dysregulation, and advanced immunomodulatory strategies. Collaboration networks remain predominantly regional despite strong contributions from the United States, Europe, and Asia, with limited integration between mechanistic research groups and clinical trial consortia. Among immune-directed therapeutic strategies, regulatory T cell modulation and microglial-targeted approaches exhibit the highest translational readiness. These findings suggest that the lack of effective ALS immunotherapeutics reflects not only biological complexity but also structural and strategic misalignment within the research ecosystem. This bibliometric analysis provides a systems-level framework to guide more integrated translational strategies in ALS immunotherapeutics development."
10.1080/19490976.2026.2617694,41586772,2026,Gut bacteria presence in the brain is increased after ischemic stroke in mice.,Gut microbes,"Peh A, Dinakis E, Nakai M, Muralitharan RR, Rupasinghe S, Wilson JL, Wong CHY, Jama HA, Barker CMO, Modarresi M, Kemp-Harper BK, Zheng T, Marques FZ, Broughton BRS.",1,microglia ALS single-cell amyotrophic lateral sclerosis [recent],"Systemic infections are a common cause of complications and death after stroke. These infections can occur due to the breakdown of the gut epithelial barrier and the translocation of bacteria from the gut to peripheral systemic tissues. However, it remains unclear whether gut bacteria also translocate to the brain and contribute to stroke-induced neuronal damage. In this study, we observed a significant number of peptidoglycan- and lipopolysaccharide-positive bacteria in the ischemic hemisphere of mice subjected to either photothrombotic (PT) stroke or middle cerebral artery occlusion (MCAO). In contrast, no bacteria were observed in the ischemic brains of germ-free mice following MCAO. Absolute quantification via PCR also revealed increased bacteria in the ischemic hemisphere and blood of PT mice. Bacterial translocation to the brain is associated with the breakdown of the gut-epithelial and blood-brain barriers. Although inhibition of sympathetic tone reduces gut-epithelial barrier permeability, the bacterial load in the brain and functional deficits poststroke, it does not affect cerebral apoptosis, neuroinflammation or infarct volume. Collectively, these findings indicate that activation of the sympathetic nervous system after stroke promotes the migration of gut-derived bacteria into the ischemic brain, and this process worsens motor function in mice."
10.3892/mmr.2026.13921,42212363,2026,Elucidating the multitarget neuroprotective mechanisms of protocatechuic acid in neurological disorders (Review).,Molecular medicine reports,"Xue X, Lai Y, Song S, Wu L, Wang L.",0,microglia ALS single-cell amyotrophic lateral sclerosis [recent],"Neurological disorders such as Alzheimer's disease (AD), Parkinson's disease (PD), cerebral ischemia, anxiety and depression pose significant global public health challenges due to their high prevalence and complex pathological mechanisms. Current therapeutic strategies primarily offer symptomatic relief, with limited efficacy in mitigating disease progression. Neuroprotection involves interventions aimed at preserving neuronal structure and function through mechanisms such as reducing oxidative stress, modulating inflammation and inhibiting apoptosis, presenting a promising avenue for treating these conditions. Protocatechuic acid (PCA), a natural phenolic acid compound prevalent in a variety of foods and herbal medicines, has received considerable attention for its notable antioxidant, anti‑inflammatory and neuroprotective properties. The present study systematically reviews the neuroprotective effects and molecular mechanisms of PCA in various neurological disorders (including AD, PD and cerebral ischemia). The present review highlights the multi‑target mechanisms of PCA, which act by mitigating oxidative stress, neuroinflammation, mitochondrial dysfunction and apoptosis, while promoting neuronal regeneration. Furthermore, the present review integrates the body of evidence across neurological contexts to identify conserved protective pathways and discusses the translational potential of PCA, providing a foundation for its clinical application in treating neurological diseases."
10.1016/j.redox.2026.104218,42202637,2026,FOXO family and neurodegenerative diseases: Mechanisms of action and therapeutic potential.,Redox biology,"Lv Z, Liu X, Zhou Z, Huang Q, Liu H, Xu Z, Xu P.",0,microglia ALS single-cell amyotrophic lateral sclerosis [recent],"Neurodegenerative diseases (NDDs) lack effective disease-modifying therapies. The FOXO transcription factors serve as integrative hubs of cellular stress responses, operating through cell-autonomous homeostasis, intercellular coordination, intracellular quality control, and cell fate decisions four hierarchical tiers. This review systematically examines isoform-specific functions: FOXO1 governs metabolic reprogramming and mitochondrial biogenesis; FOXO3 acts as the principal oxidative stress sensor with context-dependent neuroprotective or pro-apoptotic outputs; FOXO4 regulates cellular senescence; and FOXO6 maintains synaptic metabolic support. These functions vary across cell types and disease stages, with post-translational modifications determining functional transitions. FOXO proteins participate in complex interactions with disease-specific pathological proteins, either promoting clearance and repair or exacerbating neurodegeneration depending on stress intensity and chronicity. Therapeutic strategies targeting FOXO remain in preclinical and early clinical stages. Key challenges include disease stage-dependent dosing, cell-type-specific delivery, blood-brain barrier penetration, and metabolic side effects. Future directions emphasize biomarker-guided patient stratification and precision interventions aligned with the spatiotemporal dynamics of FOXO signaling. Unlike prior reviews focusing on single pathways or diseases, this work integrates isoform-specific, stage-dependent, and cell-type-resolved FOXO functions into a unifying hierarchical framework."
10.1016/j.redox.2026.104223,42177837,2026,Nitration in cancer signaling.,Redox biology,"Claassen I, Adrita N, Chandler KB, Black SM, Roberts BR, Estevez AG, Beckman JS, Franco MC.",0,microglia ALS single-cell amyotrophic lateral sclerosis [recent],"Oxidative stress arises from an imbalance between the production of reactive oxygen and nitrogen species (ROS and RNS, respectively) and the capacity of cellular antioxidant defenses to neutralize them. In cancer, this imbalance drives pathological remodeling of signaling networks that promote tumor initiation and progression. Among RNS, nitric oxide (·NO) and its highly reactive derivative peroxynitrite (ONOO<sup>-</sup>) are central mediators of redox dysregulation within the tumor microenvironment. These species induce site-specific post-translational modifications (PTMs), most notably protein tyrosine nitration, which can profoundly alter protein structure, function, interaction networks, and turnover, thereby reshaping essential cellular processes. In this review, we examine the molecular mechanisms of oxidative stress with a particular emphasis on nitration-driven protein modifications and their impact on oncogenic signaling. We highlight accumulating evidence that selective nitration of key signaling proteins actively contributes to multiple hallmarks of malignancy. These nitration events promote tumor initiation and growth, aberrant proliferation, migration and metastasis, metabolic reprogramming, angiogenesis, invasion, resistance to apoptosis, and immune evasion through disruption of core signaling pathways, cell-cycle control, and cell-death programs. Collectively, these findings support an emerging paradigm in which nitrated proteins are not merely passive byproducts of oxidative stress but active effectors of tumorigenesis. We discuss the translational implications of this concept, positioning protein tyrosine nitration as a source of mechanistically defined biomarkers and therapeutic vulnerabilities. A deeper understanding of the selectivity, structural consequences, and biological impact of protein tyrosine nitration will be essential for developing innovative precision strategies to modulate redox signaling in cancer and ultimately improve clinical o"
10.1016/j.redox.2026.104215,42143971,2026,The Glutamate-Glutathione axis in neuropsychiatric disorders and cancer: From shared mechanisms to non-invasive biomarkers.,Redox biology,"Wang R, Li Y, Shi D, Huang H, Ren Z, Ge Y, Chang Y, Yan G.",0,microglia ALS single-cell amyotrophic lateral sclerosis [recent],"Glutamate is the most abundant excitatory neurotransmitter in the central nervous system and a key non-essential amino acid in the body. It plays a central role in maintaining the excitatory-inhibitory balance of the nervous system, regulating systemic metabolic homeostasis, and participating in immune modulation. Additionally, it serves as a precursor for glutathione synthesis. Glutathione is a vital antioxidant and detoxifying molecule in organisms, capable of directly scavenging reactive oxygen species or toxic metabolites. Dysfunction of glutathione is associated with oxidative stress-related diseases. Given the critical roles of glutamate and glutathione in physiological and pathological states, we aim to systematically elucidates the metabolic interplay between glutamate and glutathione, referred to here as the Glutamate-Glutathione axis, as an integrative conceptual framework grounded in established biochemistry. By detailing the metabolic interplay of glutamate and glutathione, this review explores their mutually influential mechanisms. Furthermore, it summarizes the relevant signaling pathways and regulatory mechanisms within the Glutamate-Glutathione axis, clarifying its pivotal role in disease pathogenesis, with a particular focus on neuropsychiatric disorders and cancer. Finally, we aim to review non-invasive methods for detecting glutamate and glutathione using magnetic resonance imaging and presents our specialized sequence. This approach aims to provide a valuable non-invasive imaging tool for early diagnosis, efficacy evaluation, and therapeutic target development in related diseases. By integrating foundational metabolic networks, molecular regulatory mechanisms, disease associations, and clinical detection techniques, this review aim to establish the research framework of the Glutamate-Glutathione axis, fostering deeper integration and advancement from bench to bedside in this field."
10.1016/j.bbih.2026.101230,42004492,2026,Theiler's murine encephalomyelitis virus as the infectious agent for a virally induced mouse model of Parkinson's disease.,"Brain, behavior, & immunity - health","Kang TW, Srinivasan R, Brinkmeyer-Langford C, Welsh CJ.",0,microglia ALS single-cell amyotrophic lateral sclerosis [recent],"Parkinson's disease (PD) is the second most common neurodegenerative disorder with a prevalence of over ten million patients worldwide. The etiology of PD remains unclear but neuroinflammation specifically associated with viral infection has risen as a possible contributor to the disease. Classical animal models of PD reproduce certain pathophysiological outcomes such as the degeneration of dopaminergic (DA) neurons in the substantia nigra pars compacta (SNc), but these models are limited by the need to inject harmful neurotoxins to induce disease-like symptoms. We present a virally induced neuroinflammatory model of PD in C57BL/6J mice using a naturally occurring pathogen, Theiler's murine encephalomyelitis virus (TMEV), as the infectious agent. This model offers a tool for advancing our understanding of PD pathogenesis and potential treatment options."
10.1111/jnc.70493,42283221,2026,Effects of Lysine Deacetylation Inhibition Alone or in Combination With Arimoclomol on TDP-43 Proteinopathy.,Journal of neurochemistry,"Scozzari S, Columbro SF, Favagrossa M, Tortarolo M, Cagnotto A, Salmona M, De Marco G, Bendotti C, Calvo A, Pasetto L, Bonetto V.",0,microglia ALS single-cell amyotrophic lateral sclerosis [recent],"Cytoplasmic inclusions containing TAR DNA-binding protein 43 kDa (TDP-43) are recognized as a major pathological feature of amyotrophic lateral sclerosis (ALS) and frontotemporal dementia. Peptidyl-prolyl cis-trans isomerase A (PPIA) interacts with TDP-43 and influences its aggregation and function. This interaction is facilitated by PPIA Lys-acetylation. Here, we investigated whether restoring lysine acetylation homeostasis exerts protective effects on TDP-43 proteinopathy in vitro and in vivo and how this relates with PPIA. We found that vorinostat/SAHA, a broad-spectrum histone deacetylase (HDAC) inhibitor that increases PPIA acetylation, is able to reverse TDP-43 mislocalization in a cellular model of TDP-43 proteinopathy. We confirmed its effects in peripheral blood mononuclear cells from ALS patients and explored its impact on TDP-43 proteinopathy and PPIA acetylation in the Thy1-hTDP-43 mouse model. Thy1-hTDP-43 mice treated with SAHA showed a delayed onset of TDP-43 pathology, associated with PPIA nucleus-cytoplasm redistribution, lower neurodegeneration and neuroinflammation, and improved neuromuscular function markers. However, these effects were transient. When combined with arimoclomol, a heat shock protein co-inducer, a mitigation of the neurodegeneration was sustained. A synergistic effect was observed in periphery, greatly enhancing tubulin acetylation and reducing phosphorylated TDP-43 accumulation in the sciatic nerve and acetylcholine receptor γ-subunit expression in gastrocnemius muscle. This study suggests that HDAC inhibition could be beneficial in restoring TDP-43 localization and function through multiple mechanisms, including modulation of PPIA acetylation. The combination of lysine deacetylation inhibition and arimoclomol shows a synergistic effect in vivo and has potential as a therapeutic approach for patients."
